{"$schema":"https://json-schema.org/draft/2020-12/schema","$id":"https://mindclade.dev/schemas/feature-bundle/v1","title":"FeatureBundle","type":"object","additionalProperties":false,"required":["schema_version","kind","metadata","spec","lineage","integrity"],"properties":{"schema_version":{"const":"mindclade.feature-bundle/v1"},"kind":{"const":"FeatureBundle"},"metadata":{"$ref":"#/$defs/metadata"},"spec":{"type":"object","additionalProperties":false,"required":["dataset","manifests","bundle_index","immutable_references"],"properties":{"dataset":{"$ref":"#/$defs/artifact_ref"},"manifests":{"type":"array","minItems":1,"maxItems":256,"items":{"$ref":"#/$defs/artifact_ref"}},"bundle_index":{"$ref":"#/$defs/artifact_ref"},"immutable_references":{"const":true}}},"lineage":{"type":"array","minItems":1,"maxItems":256,"items":{"$ref":"#/$defs/artifact_ref"}},"integrity":{"$ref":"#/$defs/integrity"}},"$defs":{"digest":{"type":"string","pattern":"^sha256:[a-f0-9]{64}$"},"metadata":{"type":"object","additionalProperties":false,"required":["uid","created_at","producer","classification"],"properties":{"uid":{"type":"string","minLength":1,"maxLength":128},"created_at":{"type":"string","format":"date-time"},"producer":{"type":"string","minLength":1,"maxLength":128},"classification":{"enum":["PUBLIC","INTERNAL","RESTRICTED"]}}},"artifact_ref":{"type":"object","additionalProperties":false,"required":["uri","digest","media_type","schema_version"],"properties":{"uri":{"type":"string","pattern":"^artifacts/[A-Za-z0-9._~/-]+$"},"digest":{"$ref":"#/$defs/digest"},"media_type":{"type":"string","minLength":1,"maxLength":128},"schema_version":{"type":"string","minLength":1,"maxLength":128}}},"integrity":{"type":"object","additionalProperties":false,"required":["payload_digest"],"properties":{"payload_digest":{"$ref":"#/$defs/digest"},"evidence":{"type":"array","maxItems":32,"items":{"$ref":"#/$defs/artifact_ref"}}}}}}
