{"schema_version":"mindclade.feature-bundle/v1","kind":"FeatureBundle","metadata":{"uid":"bundle-001","created_at":"2026-08-31T12:00:00Z","producer":"feature-worker","classification":"INTERNAL"},"spec":{"dataset":{"uri":"artifacts/datasets/001","digest":"sha256:aaaaaaaaaaaaaaaaaaaaaaaaaaaaaaaaaaaaaaaaaaaaaaaaaaaaaaaaaaaaaaaa","media_type":"application/schema+json","schema_version":"mindclade.dataset-manifest/v1"},"manifests":[{"uri":"artifacts/feature-manifests/001","digest":"sha256:bbbbbbbbbbbbbbbbbbbbbbbbbbbbbbbbbbbbbbbbbbbbbbbbbbbbbbbbbbbbbbbb","media_type":"application/schema+json","schema_version":"mindclade.feature-manifest/v1"}],"bundle_index":{"uri":"artifacts/feature-bundles/001/index","digest":"sha256:cccccccccccccccccccccccccccccccccccccccccccccccccccccccccccccccc","media_type":"application/json","schema_version":"mindclade.feature-bundle-index/v1"},"immutable_references":true},"lineage":[{"uri":"artifacts/feature-manifests/001","digest":"sha256:bbbbbbbbbbbbbbbbbbbbbbbbbbbbbbbbbbbbbbbbbbbbbbbbbbbbbbbbbbbbbbbb","media_type":"application/schema+json","schema_version":"mindclade.feature-manifest/v1"}],"integrity":{"payload_digest":"sha256:dddddddddddddddddddddddddddddddddddddddddddddddddddddddddddddddd","evidence":[]}}
